{"SchemaVersion":1,"ArtifactKind":"canonical-transaction-plan","Metadata":{"CreatedAtUtc":"2026-08-11T00:00:00.0000000Z","Generator":"scripts/canonical-transaction.ps1","RepositoryCommit":"1111111111111111111111111111111111111111"},"PlanPayload":{"OperationKind":"setup","RepoRoot":"C:\\fixture\\repo","GitCommonDirHash":"aaaaaaaaaaaaaaaaaaaaaaaaaaaaaaaaaaaaaaaaaaaaaaaaaaaaaaaaaaaaaaaa","WorktreeId":"bbbbbbbbbbbbbbbbbbbbbbbbbbbbbbbbbbbbbbbbbbbbbbbbbbbbbbbbbbbbbbbb","RepositoryCommit":"1111111111111111111111111111111111111111","ToolchainPolicyHash":"cccccccccccccccccccccccccccccccccccccccccccccccccccccccccccccccc","FilesystemCapabilityHash":"dddddddddddddddddddddddddddddddddddddddddddddddddddddddddddddddd","UnknownGeneratedInventory":[],"ExpectedPostconditionsHash":"4444444444444444444444444444444444444444444444444444444444444444","PrivateRootBootstrapIntent":{"OwnerSid":"S-1-5-21-1000","SecurityResolverVersion":"windows-token-sid-current-user-only-v1","SecurityTemplateHash":"1111111111111111111111111111111111111111111111111111111111111111","CanonicalRecoveryRootIntent":{"ResolverVersion":"windows-token-sid-current-user-only-v1","TargetStatus":"MISSING","LocationKey":"c:/fixture/canonical-recovery","RequestedPath":"C:\\fixture\\canonical-recovery","VolumeId":"volume-fixture","DeepestExistingParentPath":"C:\\fixture","DeepestExistingParentIdentity":"volume:parent","DeepestExistingParentOwnerSid":"S-1-5-21-1000","DeepestExistingParentDaclHash":"2222222222222222222222222222222222222222222222222222222222222222","MissingRemainder":["canonical-recovery"],"ExpectedFinalOwnerSid":"S-1-5-21-1000","ExpectedFinalDaclTemplateHash":"1111111111111111111111111111111111111111111111111111111111111111","FinalDirectoryIdentity":null,"FinalOwnerSid":null,"FinalDaclHash":null},"CanonicalRecoveryRootIntentHash":"cccccccccccccccccccccccccccccccccccccccccccccccccccccccccccccccc","ControlBaseIntent":{"ResolverVersion":"windows-token-sid-current-user-only-v1","TargetStatus":"MISSING","LocationKey":"c:/fixture/control","RequestedPath":"C:\\fixture\\control","VolumeId":"volume-fixture","DeepestExistingParentPath":"C:\\fixture","DeepestExistingParentIdentity":"volume:parent","DeepestExistingParentOwnerSid":"S-1-5-21-1000","DeepestExistingParentDaclHash":"2222222222222222222222222222222222222222222222222222222222222222","MissingRemainder":["control"],"ExpectedFinalOwnerSid":"S-1-5-21-1000","ExpectedFinalDaclTemplateHash":"1111111111111111111111111111111111111111111111111111111111111111","FinalDirectoryIdentity":null,"FinalOwnerSid":null,"FinalDaclHash":null},"ControlBaseIntentHash":"eeeeeeeeeeeeeeeeeeeeeeeeeeeeeeeeeeeeeeeeeeeeeeeeeeeeeeeeeeeeeeee","BackupRootIntent":{"ResolverVersion":"windows-token-sid-current-user-only-v1","TargetStatus":"MISSING","LocationKey":"c:/fixture/backups","RequestedPath":"C:\\fixture\\backups","VolumeId":"volume-fixture","DeepestExistingParentPath":"C:\\fixture","DeepestExistingParentIdentity":"volume:parent","DeepestExistingParentOwnerSid":"S-1-5-21-1000","DeepestExistingParentDaclHash":"2222222222222222222222222222222222222222222222222222222222222222","MissingRemainder":["backups"],"ExpectedFinalOwnerSid":"S-1-5-21-1000","ExpectedFinalDaclTemplateHash":"1111111111111111111111111111111111111111111111111111111111111111","FinalDirectoryIdentity":null,"FinalOwnerSid":null,"FinalDaclHash":null},"BackupRootIntentHash":"ffffffffffffffffffffffffffffffffffffffffffffffffffffffffffffffff"},"SetupIntentHash":"3333333333333333333333333333333333333333333333333333333333333333","ExpectedRootClaim":{},"ExpectedRootClaimHash":"2222222222222222222222222222222222222222222222222222222222222222","ExpectedSetupStateProjection":{"SchemaVersion":1,"ArtifactKind":"canonical-setup-state-projection","RepoId":"aaaaaaaaaaaaaaaaaaaaaaaaaaaaaaaaaaaaaaaaaaaaaaaaaaaaaaaaaaaaaaaa","ClaimId":"aaaaaaaaaaaaaaaaaaaaaaaaaaaaaaaaaaaaaaaaaaaaaaaaaaaaaaaaaaaaaaaa","GitCommonDirHash":"bbbbbbbbbbbbbbbbbbbbbbbbbbbbbbbbbbbbbbbbbbbbbbbbbbbbbbbbbbbbbbbb","OwnerSid":"S-1-5-21-1000","SecurityResolverVersion":"windows-token-sid-current-user-only-v1","SecurityTemplateHash":"1111111111111111111111111111111111111111111111111111111111111111","CanonicalRecoveryRoot":"C:\\fixture\\canonical-recovery","CanonicalRecoveryRootIntent":{"ResolverVersion":"windows-token-sid-current-user-only-v1","TargetStatus":"MISSING","LocationKey":"c:/fixture/canonical-recovery","RequestedPath":"C:\\fixture\\canonical-recovery","VolumeId":"volume-fixture","DeepestExistingParentPath":"C:\\fixture","DeepestExistingParentIdentity":"volume:parent","DeepestExistingParentOwnerSid":"S-1-5-21-1000","DeepestExistingParentDaclHash":"2222222222222222222222222222222222222222222222222222222222222222","MissingRemainder":["canonical-recovery"],"ExpectedFinalOwnerSid":"S-1-5-21-1000","ExpectedFinalDaclTemplateHash":"1111111111111111111111111111111111111111111111111111111111111111","FinalDirectoryIdentity":null,"FinalOwnerSid":null,"FinalDaclHash":null},"CanonicalRecoveryRootIntentHash":"cccccccccccccccccccccccccccccccccccccccccccccccccccccccccccccccc","FilesystemCapabilityHash":"dddddddddddddddddddddddddddddddddddddddddddddddddddddddddddddddd","ControlBase":"C:\\fixture\\control","ControlBaseIntent":{"ResolverVersion":"windows-token-sid-current-user-only-v1","TargetStatus":"MISSING","LocationKey":"c:/fixture/control","RequestedPath":"C:\\fixture\\control","VolumeId":"volume-fixture","DeepestExistingParentPath":"C:\\fixture","DeepestExistingParentIdentity":"volume:parent","DeepestExistingParentOwnerSid":"S-1-5-21-1000","DeepestExistingParentDaclHash":"2222222222222222222222222222222222222222222222222222222222222222","MissingRemainder":["control"],"ExpectedFinalOwnerSid":"S-1-5-21-1000","ExpectedFinalDaclTemplateHash":"1111111111111111111111111111111111111111111111111111111111111111","FinalDirectoryIdentity":null,"FinalOwnerSid":null,"FinalDaclHash":null},"ControlBaseIntentHash":"eeeeeeeeeeeeeeeeeeeeeeeeeeeeeeeeeeeeeeeeeeeeeeeeeeeeeeeeeeeeeeee","BackupRoot":"C:\\fixture\\backups","BackupRootIntent":{"ResolverVersion":"windows-token-sid-current-user-only-v1","TargetStatus":"MISSING","LocationKey":"c:/fixture/backups","RequestedPath":"C:\\fixture\\backups","VolumeId":"volume-fixture","DeepestExistingParentPath":"C:\\fixture","DeepestExistingParentIdentity":"volume:parent","DeepestExistingParentOwnerSid":"S-1-5-21-1000","DeepestExistingParentDaclHash":"2222222222222222222222222222222222222222222222222222222222222222","MissingRemainder":["backups"],"ExpectedFinalOwnerSid":"S-1-5-21-1000","ExpectedFinalDaclTemplateHash":"1111111111111111111111111111111111111111111111111111111111111111","FinalDirectoryIdentity":null,"FinalOwnerSid":null,"FinalDaclHash":null},"BackupRootIntentHash":"ffffffffffffffffffffffffffffffffffffffffffffffffffffffffffffffff","SetupIntentHash":"3333333333333333333333333333333333333333333333333333333333333333"},"ExpectedSetupStateProjectionHash":"4444444444444444444444444444444444444444444444444444444444444444"},"PlanHash":"491a14b1868ef8c85fe20df4422ffe3418312c30b27f37e29689dedbc2ca898d","DocumentHash":"2b890f68521d774723a1121266003ecfc8ef515a1fa43145394f18e52d7c24dc"}
